{
  "schema_version": 1,
  "tool_version": "0.1.0-dev",
  "input": "/tmp/tmp.inf2qYeGjV/initial.txt",
  "requested_output": "/tmp/tmp.inf2qYeGjV/reduced.txt",
  "report": "/tmp/tmp.inf2qYeGjV/report.json",
  "output": "/tmp/tmp.inf2qYeGjV/reduced.txt",
  "oracle_argv": [
    "python3",
    "examples/algorithm/oracle.py",
    "--reference",
    "/tmp/tmp.inf2qYeGjV/reference",
    "--buggy",
    "/tmp/tmp.inf2qYeGjV/buggy"
  ],
  "original_bytes": 310,
  "original_segments": 96,
  "best_bytes": 9,
  "best_segments": 3,
  "best_positions": [
    46,
    47,
    48
  ],
  "stop_reason": "completed",
  "exit_code": 0,
  "search_stop_reason": "completed",
  "initial_check": "interesting",
  "final_revalidation": "interesting",
  "minimality": "verified",
  "minimality_reason": "all_single_deletions_not_interesting",
  "minimality_checked": 3,
  "minimality_required": 3,
  "tests_started": 98,
  "tests_counting_unit": "controlled_launcher_start",
  "launch_attempts": 98,
  "launch_failures": 0,
  "tests_by_phase": {
    "initial": 1,
    "search": 93,
    "minimality": 3,
    "final": 1
  },
  "interesting": 13,
  "not_interesting": 85,
  "unresolved": 0,
  "timeouts": 0,
  "oracle_errors": 0,
  "interrupted_tests": 0,
  "error": null,
  "last_exit_code": 0,
  "last_signal": null,
  "max_tests": 500,
  "timeout_ms": 5000,
  "elapsed_ms": 9246,
  "had_unresolved": false,
  "interrupted": false,
  "cache_enabled": false,
  "cache_hits": 0,
  "output_saved": true,
  "result_status": "revalidated_interesting",
  "only_previously_observed_interesting": false,
  "diagnostics": {
    "stdout": "reference=33; buggy=19; signature=reference_greater\n",
    "stderr": "",
    "stdout_truncated": false,
    "stderr_truncated": false
  }
}
